<?xml version="1.0" encoding="UTF-8"?>
<xs:schema xmlns:xs="http://www.w3.org/2001/XMLSchema">
 <xs:element name="employees">
  <xs:complexType>
    <xs:sequence>
        <xs:element name="employee" maxOccurs="unbounded">
            <xs:complexType>
                <xs:sequence>
                    <xs:element name="id" type="xs:integer"/>
                    <xs:element name="name" type="xs:string"/>
                    <xs:element name="depart" type="xs:string"/>
                    <xs:element name="courses" maxOccurs="unbounded">
                        <xs:complexType>
                            <xs:sequence>
                                <xs:element name="course1" type="xs:string"/>
                                <xs:element name="course2" type="xs:string"/>
                            </xs:sequence>
                        </xs:complexType>
                    </xs:element>
                </xs:sequence>
            </xs:complexType>
        </xs:element>
    </xs:sequence>
  </xs:complexType>
 </xs:element>
</xs:schema>