<?xml version="1.0" encoding="UTF-8"?>
<employees xmlns:xsi="http://www.w3.org/2001/XMLSchema-instance" xsi:noNamespaceSchemaLocation="index3.xsd">
    <employee>
        <id>244</id>
        <name>asad</name>
        <depart>software sales</depart>
        <courses>
            <course1>information technology</course1>
            <course2>software engineering</course2>
        </courses>
    </employee>
    <employee>
        <id>345</id>
        <name>azlaan</name>
        <depart>acadmices</depart>
        <courses>
            <course1>information technology</course1>
            <course2>software engineering</course2>
        </courses>
    </employee>
    <employee>
        <id>256</id>
        <name>mansab</name>
        <depart>accounts</depart>
        <courses>
            <course1>information technology</course1>
            <course2>software engineering</course2>
        </courses>
    </employee>
    <employee>
        <id>567</id>
        <name>rohaan</name>
        <depart>sales</depart>
        <courses>
            <course1>information technology</course1>
            <course2>software engineering</course2>
        </courses>
    </employee>
</employees>